No.     Time           Source                Destination           Protocol Length Info
      1 0.000000       76.223.31.44          192.168.0.111         TLSv1.2  94     Application Data

Frame 1: 94 bytes on wire (752 bits), 94 bytes captured (752 bits) on interface \Device\NPF_{67513490-7E98-4839-87BB-68E6C8BE38B4}, id 0
Ethernet II, Src: Tp-LinkT_94:6f:72 (84:d8:1b:94:6f:72), Dst: Chongqin_1c:7e:89 (a4:97:b1:1c:7e:89)
Internet Protocol Version 4, Src: 76.223.31.44, Dst: 192.168.0.111
Transmission Control Protocol, Src Port: 443, Dst Port: 50395, Seq: 1, Ack: 1, Len: 40
Transport Layer Security

No.     Time           Source                Destination           Protocol Length Info
      2 0.015642       192.168.0.111         76.223.31.44          TLSv1.2  96     Application Data

Frame 2: 96 bytes on wire (768 bits), 96 bytes captured (768 bits) on interface \Device\NPF_{67513490-7E98-4839-87BB-68E6C8BE38B4}, id 0
Ethernet II, Src: Chongqin_1c:7e:89 (a4:97:b1:1c:7e:89), Dst: Tp-LinkT_94:6f:72 (84:d8:1b:94:6f:72)
Internet Protocol Version 4, Src: 192.168.0.111, Dst: 76.223.31.44
Transmission Control Protocol, Src Port: 50395, Dst Port: 443, Seq: 1, Ack: 41, Len: 42
Transport Layer Security

No.     Time           Source                Destination           Protocol Length Info
      3 0.015825       192.168.0.111         76.223.31.44          TLSv1.2  96     Application Data

Frame 3: 96 bytes on wire (768 bits), 96 bytes captured (768 bits) on interface \Device\NPF_{67513490-7E98-4839-87BB-68E6C8BE38B4}, id 0
Ethernet II, Src: Chongqin_1c:7e:89 (a4:97:b1:1c:7e:89), Dst: Tp-LinkT_94:6f:72 (84:d8:1b:94:6f:72)
Internet Protocol Version 4, Src: 192.168.0.111, Dst: 76.223.31.44
Transmission Control Protocol, Src Port: 50395, Dst Port: 443, Seq: 43, Ack: 41, Len: 42
Transport Layer Security

No.     Time           Source                Destination           Protocol Length Info
      4 0.064036       76.223.31.44          192.168.0.111         TCP      54     443 → 50395 [ACK] Seq=41 Ack=43 Win=114 Len=0

Frame 4: 54 bytes on wire (432 bits), 54 bytes captured (432 bits) on interface \Device\NPF_{67513490-7E98-4839-87BB-68E6C8BE38B4}, id 0
Ethernet II, Src: Tp-LinkT_94:6f:72 (84:d8:1b:94:6f:72), Dst: Chongqin_1c:7e:89 (a4:97:b1:1c:7e:89)
Internet Protocol Version 4, Src: 76.223.31.44, Dst: 192.168.0.111
Transmission Control Protocol, Src Port: 443, Dst Port: 50395, Seq: 41, Ack: 43, Len: 0

No.     Time           Source                Destination           Protocol Length Info
      5 0.064036       76.223.31.44          192.168.0.111         TCP      54     443 → 50395 [ACK] Seq=41 Ack=85 Win=114 Len=0

Frame 5: 54 bytes on wire (432 bits), 54 bytes captured (432 bits) on interface \Device\NPF_{67513490-7E98-4839-87BB-68E6C8BE38B4}, id 0
Ethernet II, Src: Tp-LinkT_94:6f:72 (84:d8:1b:94:6f:72), Dst: Chongqin_1c:7e:89 (a4:97:b1:1c:7e:89)
Internet Protocol Version 4, Src: 76.223.31.44, Dst: 192.168.0.111
Transmission Control Protocol, Src Port: 443, Dst Port: 50395, Seq: 41, Ack: 85, Len: 0

No.     Time           Source                Destination           Protocol Length Info
      6 2.112362       fe80::86d8:1bff:fe94:6f72 ff02::1               ICMPv6   110    Router Advertisement from 84:d8:1b:94:6f:72

Frame 6: 110 bytes on wire (880 bits), 110 bytes captured (880 bits) on interface \Device\NPF_{67513490-7E98-4839-87BB-68E6C8BE38B4}, id 0
Ethernet II, Src: Tp-LinkT_94:6f:72 (84:d8:1b:94:6f:72), Dst: Chongqin_1c:7e:89 (a4:97:b1:1c:7e:89)
Internet Protocol Version 6, Src: fe80::86d8:1bff:fe94:6f72, Dst: ff02::1
Internet Control Message Protocol v6

No.     Time           Source                Destination           Protocol Length Info
      7 5.293890       Tp-LinkT_94:6f:72     Chongqin_1c:7e:89     ARP      60     Who has 192.168.0.111? Tell 192.168.0.1

Frame 7: 60 bytes on wire (480 bits), 60 bytes captured (480 bits) on interface \Device\NPF_{67513490-7E98-4839-87BB-68E6C8BE38B4}, id 0
Ethernet II, Src: Tp-LinkT_94:6f:72 (84:d8:1b:94:6f:72), Dst: Chongqin_1c:7e:89 (a4:97:b1:1c:7e:89)
Address Resolution Protocol (request)

No.     Time           Source                Destination           Protocol Length Info
      8 5.293928       Chongqin_1c:7e:89     Tp-LinkT_94:6f:72     ARP      42     192.168.0.111 is at a4:97:b1:1c:7e:89

Frame 8: 42 bytes on wire (336 bits), 42 bytes captured (336 bits) on interface \Device\NPF_{67513490-7E98-4839-87BB-68E6C8BE38B4}, id 0
Ethernet II, Src: Chongqin_1c:7e:89 (a4:97:b1:1c:7e:89), Dst: Tp-LinkT_94:6f:72 (84:d8:1b:94:6f:72)
Address Resolution Protocol (reply)

No.     Time           Source                Destination           Protocol Length Info
      9 6.949914       Tp-LinkT_94:6f:72     Chongqin_1c:7e:89     ARP      60     Who has 192.168.0.111? Tell 192.168.0.1

Frame 9: 60 bytes on wire (480 bits), 60 bytes captured (480 bits) on interface \Device\NPF_{67513490-7E98-4839-87BB-68E6C8BE38B4}, id 0
Ethernet II, Src: Tp-LinkT_94:6f:72 (84:d8:1b:94:6f:72), Dst: Chongqin_1c:7e:89 (a4:97:b1:1c:7e:89)
Address Resolution Protocol (request)

No.     Time           Source                Destination           Protocol Length Info
     10 6.949951       Chongqin_1c:7e:89     Tp-LinkT_94:6f:72     ARP      42     192.168.0.111 is at a4:97:b1:1c:7e:89

Frame 10: 42 bytes on wire (336 bits), 42 bytes captured (336 bits) on interface \Device\NPF_{67513490-7E98-4839-87BB-68E6C8BE38B4}, id 0
Ethernet II, Src: Chongqin_1c:7e:89 (a4:97:b1:1c:7e:89), Dst: Tp-LinkT_94:6f:72 (84:d8:1b:94:6f:72)
Address Resolution Protocol (reply)

No.     Time           Source                Destination           Protocol Length Info
     11 7.510191       Tp-LinkT_94:6f:72     Chongqin_1c:7e:89     ARP      60     Who has 192.168.0.111? Tell 192.168.0.1

Frame 11: 60 bytes on wire (480 bits), 60 bytes captured (480 bits) on interface \Device\NPF_{67513490-7E98-4839-87BB-68E6C8BE38B4}, id 0
Ethernet II, Src: Tp-LinkT_94:6f:72 (84:d8:1b:94:6f:72), Dst: Chongqin_1c:7e:89 (a4:97:b1:1c:7e:89)
Address Resolution Protocol (request)

No.     Time           Source                Destination           Protocol Length Info
     12 7.510222       Chongqin_1c:7e:89     Tp-LinkT_94:6f:72     ARP      42     192.168.0.111 is at a4:97:b1:1c:7e:89

Frame 12: 42 bytes on wire (336 bits), 42 bytes captured (336 bits) on interface \Device\NPF_{67513490-7E98-4839-87BB-68E6C8BE38B4}, id 0
Ethernet II, Src: Chongqin_1c:7e:89 (a4:97:b1:1c:7e:89), Dst: Tp-LinkT_94:6f:72 (84:d8:1b:94:6f:72)
Address Resolution Protocol (reply)

No.     Time           Source                Destination           Protocol Length Info
     13 8.477319       192.168.0.1           224.0.0.1             IGMPv3   50     Membership Query, general

Frame 13: 50 bytes on wire (400 bits), 50 bytes captured (400 bits) on interface \Device\NPF_{67513490-7E98-4839-87BB-68E6C8BE38B4}, id 0
Ethernet II, Src: Tp-LinkT_94:6f:72 (84:d8:1b:94:6f:72), Dst: IPv4mcast_01 (01:00:5e:00:00:01)
Internet Protocol Version 4, Src: 192.168.0.1, Dst: 224.0.0.1
Internet Group Management Protocol

No.     Time           Source                Destination           Protocol Length Info
     14 9.872654       Tp-LinkT_94:6f:72     Chongqin_1c:7e:89     ARP      60     Who has 192.168.0.111? Tell 192.168.0.1

Frame 14: 60 bytes on wire (480 bits), 60 bytes captured (480 bits) on interface \Device\NPF_{67513490-7E98-4839-87BB-68E6C8BE38B4}, id 0
Ethernet II, Src: Tp-LinkT_94:6f:72 (84:d8:1b:94:6f:72), Dst: Chongqin_1c:7e:89 (a4:97:b1:1c:7e:89)
Address Resolution Protocol (request)

No.     Time           Source                Destination           Protocol Length Info
     15 9.872685       Chongqin_1c:7e:89     Tp-LinkT_94:6f:72     ARP      42     192.168.0.111 is at a4:97:b1:1c:7e:89

Frame 15: 42 bytes on wire (336 bits), 42 bytes captured (336 bits) on interface \Device\NPF_{67513490-7E98-4839-87BB-68E6C8BE38B4}, id 0
Ethernet II, Src: Chongqin_1c:7e:89 (a4:97:b1:1c:7e:89), Dst: Tp-LinkT_94:6f:72 (84:d8:1b:94:6f:72)
Address Resolution Protocol (reply)

No.     Time           Source                Destination           Protocol Length Info
     16 10.771324      2406:b400:a9:2da4:10b6:3fcd:3646:38e 2a03:2880:f237:1d1:face:b00c:0:167 TLSv1.2  143    Application Data

Frame 16: 143 bytes on wire (1144 bits), 143 bytes captured (1144 bits) on interface \Device\NPF_{67513490-7E98-4839-87BB-68E6C8BE38B4}, id 0
Ethernet II, Src: Chongqin_1c:7e:89 (a4:97:b1:1c:7e:89), Dst: Tp-LinkT_94:6f:72 (84:d8:1b:94:6f:72)
Internet Protocol Version 6, Src: 2406:b400:a9:2da4:10b6:3fcd:3646:38e, Dst: 2a03:2880:f237:1d1:face:b00c:0:167
Transmission Control Protocol, Src Port: 50487, Dst Port: 443, Seq: 1, Ack: 1, Len: 69
Transport Layer Security

No.     Time           Source                Destination           Protocol Length Info
     17 10.791424      2a03:2880:f237:1d1:face:b00c:0:167 2406:b400:a9:2da4:10b6:3fcd:3646:38e TCP      74     443 → 50487 [ACK] Seq=1 Ack=70 Win=282 Len=0

Frame 17: 74 bytes on wire (592 bits), 74 bytes captured (592 bits) on interface \Device\NPF_{67513490-7E98-4839-87BB-68E6C8BE38B4}, id 0
Ethernet II, Src: Tp-LinkT_94:6f:72 (84:d8:1b:94:6f:72), Dst: Chongqin_1c:7e:89 (a4:97:b1:1c:7e:89)
Internet Protocol Version 6, Src: 2a03:2880:f237:1d1:face:b00c:0:167, Dst: 2406:b400:a9:2da4:10b6:3fcd:3646:38e
Transmission Control Protocol, Src Port: 443, Dst Port: 50487, Seq: 1, Ack: 70, Len: 0

No.     Time           Source                Destination           Protocol Length Info
     18 10.986348      fe80::86d8:1bff:fe94:6f72 ff02::1               ICMPv6   110    Router Advertisement from 84:d8:1b:94:6f:72

Frame 18: 110 bytes on wire (880 bits), 110 bytes captured (880 bits) on interface \Device\NPF_{67513490-7E98-4839-87BB-68E6C8BE38B4}, id 0
Ethernet II, Src: Tp-LinkT_94:6f:72 (84:d8:1b:94:6f:72), Dst: Chongqin_1c:7e:89 (a4:97:b1:1c:7e:89)
Internet Protocol Version 6, Src: fe80::86d8:1bff:fe94:6f72, Dst: ff02::1
Internet Control Message Protocol v6

No.     Time           Source                Destination           Protocol Length Info
     19 10.999648      2a03:2880:f237:1d1:face:b00c:0:167 2406:b400:a9:2da4:10b6:3fcd:3646:38e TLSv1.2  145    Application Data

Frame 19: 145 bytes on wire (1160 bits), 145 bytes captured (1160 bits) on interface \Device\NPF_{67513490-7E98-4839-87BB-68E6C8BE38B4}, id 0
Ethernet II, Src: Tp-LinkT_94:6f:72 (84:d8:1b:94:6f:72), Dst: Chongqin_1c:7e:89 (a4:97:b1:1c:7e:89)
Internet Protocol Version 6, Src: 2a03:2880:f237:1d1:face:b00c:0:167, Dst: 2406:b400:a9:2da4:10b6:3fcd:3646:38e
Transmission Control Protocol, Src Port: 443, Dst Port: 50487, Seq: 1, Ack: 70, Len: 71
Transport Layer Security

No.     Time           Source                Destination           Protocol Length Info
     20 11.036860      192.168.0.105         224.0.0.251           MDNS     119    Standard query 0x0049 PTR _25C62B73._sub._googlecast._tcp.local, "QM" question PTR _233637DE._sub._googlecast._tcp.local, "QM" question PTR _googlecast._tcp.local, "QM" question

Frame 20: 119 bytes on wire (952 bits), 119 bytes captured (952 bits) on interface \Device\NPF_{67513490-7E98-4839-87BB-68E6C8BE38B4}, id 0
Ethernet II, Src: 3e:b7:fc:3e:a0:c2 (3e:b7:fc:3e:a0:c2), Dst: IPv4mcast_fb (01:00:5e:00:00:fb)
Internet Protocol Version 4, Src: 192.168.0.105, Dst: 224.0.0.251
User Datagram Protocol, Src Port: 5353, Dst Port: 5353
Multicast Domain Name System (query)

No.     Time           Source                Destination           Protocol Length Info
     21 11.053782      2406:b400:a9:2da4:10b6:3fcd:3646:38e 2a03:2880:f237:1d1:face:b00c:0:167 TCP      74     50487 → 443 [ACK] Seq=70 Ack=72 Win=511 Len=0

Frame 21: 74 bytes on wire (592 bits), 74 bytes captured (592 bits) on interface \Device\NPF_{67513490-7E98-4839-87BB-68E6C8BE38B4}, id 0
Ethernet II, Src: Chongqin_1c:7e:89 (a4:97:b1:1c:7e:89), Dst: Tp-LinkT_94:6f:72 (84:d8:1b:94:6f:72)
Internet Protocol Version 6, Src: 2406:b400:a9:2da4:10b6:3fcd:3646:38e, Dst: 2a03:2880:f237:1d1:face:b00c:0:167
Transmission Control Protocol, Src Port: 50487, Dst Port: 443, Seq: 70, Ack: 72, Len: 0

No.     Time           Source                Destination           Protocol Length Info
     22 14.504837      192.168.0.111         224.0.0.22            IGMPv3   54     Membership Report / Join group 224.0.0.252 for any sources

Frame 22: 54 bytes on wire (432 bits), 54 bytes captured (432 bits) on interface \Device\NPF_{67513490-7E98-4839-87BB-68E6C8BE38B4}, id 0
Ethernet II, Src: Chongqin_1c:7e:89 (a4:97:b1:1c:7e:89), Dst: IPv4mcast_16 (01:00:5e:00:00:16)
Internet Protocol Version 4, Src: 192.168.0.111, Dst: 224.0.0.22
Internet Group Management Protocol

No.     Time           Source                Destination           Protocol Length Info
     23 14.621701      192.168.0.101         224.0.0.22            IGMPv3   54     Membership Report / Join group 224.0.0.251 for any sources

Frame 23: 54 bytes on wire (432 bits), 54 bytes captured (432 bits) on interface \Device\NPF_{67513490-7E98-4839-87BB-68E6C8BE38B4}, id 0
Ethernet II, Src: XiaomiCo_14:4b:6e (04:c8:07:14:4b:6e), Dst: IPv4mcast_16 (01:00:5e:00:00:16)
Internet Protocol Version 4, Src: 192.168.0.101, Dst: 224.0.0.22
Internet Group Management Protocol

No.     Time           Source                Destination           Protocol Length Info
     24 15.385683      fe80::86d8:1bff:fe94:6f72 ff02::1               ICMPv6   90     Multicast Listener Query

Frame 24: 90 bytes on wire (720 bits), 90 bytes captured (720 bits) on interface \Device\NPF_{67513490-7E98-4839-87BB-68E6C8BE38B4}, id 0
Ethernet II, Src: Tp-LinkT_94:6f:72 (84:d8:1b:94:6f:72), Dst: Chongqin_1c:7e:89 (a4:97:b1:1c:7e:89)
Internet Protocol Version 6, Src: fe80::86d8:1bff:fe94:6f72, Dst: ff02::1
Internet Control Message Protocol v6

No.     Time           Source                Destination           Protocol Length Info
     25 15.514617      fe80::1d5a:1a4e:4bdc:acc5 ff02::16              ICMPv6   190    Multicast Listener Report Message v2

Frame 25: 190 bytes on wire (1520 bits), 190 bytes captured (1520 bits) on interface \Device\NPF_{67513490-7E98-4839-87BB-68E6C8BE38B4}, id 0
Ethernet II, Src: Chongqin_1c:7e:89 (a4:97:b1:1c:7e:89), Dst: IPv6mcast_16 (33:33:00:00:00:16)
Internet Protocol Version 6, Src: fe80::1d5a:1a4e:4bdc:acc5, Dst: ff02::16
Internet Control Message Protocol v6

No.     Time           Source                Destination           Protocol Length Info
     26 15.671674      fe80::80b5:cd37:d552:40db ff02::16              ICMPv6   170    Multicast Listener Report Message v2

Frame 26: 170 bytes on wire (1360 bits), 170 bytes captured (1360 bits) on interface \Device\NPF_{67513490-7E98-4839-87BB-68E6C8BE38B4}, id 0
Ethernet II, Src: IntelCor_fa:b2:48 (88:b1:11:fa:b2:48), Dst: Chongqin_1c:7e:89 (a4:97:b1:1c:7e:89)
Internet Protocol Version 6, Src: fe80::80b5:cd37:d552:40db, Dst: ff02::16
Internet Control Message Protocol v6

No.     Time           Source                Destination           Protocol Length Info
     27 15.671674      fe80::2db3:77cc:84d6:7df6 ff02::16              ICMPv6   170    Multicast Listener Report Message v2

Frame 27: 170 bytes on wire (1360 bits), 170 bytes captured (1360 bits) on interface \Device\NPF_{67513490-7E98-4839-87BB-68E6C8BE38B4}, id 0
Ethernet II, Src: XiaomiCo_14:4b:6e (04:c8:07:14:4b:6e), Dst: Chongqin_1c:7e:89 (a4:97:b1:1c:7e:89)
Internet Protocol Version 6, Src: fe80::2db3:77cc:84d6:7df6, Dst: ff02::16
Internet Control Message Protocol v6

No.     Time           Source                Destination           Protocol Length Info
     28 15.991652      fe80::3cb7:fcff:fe3e:a0c2 ff02::16              ICMPv6   90     Multicast Listener Report Message v2

Frame 28: 90 bytes on wire (720 bits), 90 bytes captured (720 bits) on interface \Device\NPF_{67513490-7E98-4839-87BB-68E6C8BE38B4}, id 0
Ethernet II, Src: 3e:b7:fc:3e:a0:c2 (3e:b7:fc:3e:a0:c2), Dst: Chongqin_1c:7e:89 (a4:97:b1:1c:7e:89)
Internet Protocol Version 6, Src: fe80::3cb7:fcff:fe3e:a0c2, Dst: ff02::16
Internet Control Message Protocol v6

No.     Time           Source                Destination           Protocol Length Info
     29 16.016753      192.168.0.111         224.0.0.22            IGMPv3   54     Membership Report / Join group 224.0.0.251 for any sources

Frame 29: 54 bytes on wire (432 bits), 54 bytes captured (432 bits) on interface \Device\NPF_{67513490-7E98-4839-87BB-68E6C8BE38B4}, id 0
Ethernet II, Src: Chongqin_1c:7e:89 (a4:97:b1:1c:7e:89), Dst: IPv4mcast_16 (01:00:5e:00:00:16)
Internet Protocol Version 4, Src: 192.168.0.111, Dst: 224.0.0.22
Internet Group Management Protocol

No.     Time           Source                Destination           Protocol Length Info
     30 16.459355      fe80::4f9:8577:f4ea:fd47 ff02::16              ICMPv6   150    Multicast Listener Report Message v2

Frame 30: 150 bytes on wire (1200 bits), 150 bytes captured (1200 bits) on interface \Device\NPF_{67513490-7E98-4839-87BB-68E6C8BE38B4}, id 0
Ethernet II, Src: 02:54:70:95:84:27 (02:54:70:95:84:27), Dst: Chongqin_1c:7e:89 (a4:97:b1:1c:7e:89)
Internet Protocol Version 6, Src: fe80::4f9:8577:f4ea:fd47, Dst: ff02::16
Internet Control Message Protocol v6

No.     Time           Source                Destination           Protocol Length Info
     31 16.802792      192.168.0.111         104.208.16.88         TCP      54     50564 → 443 [FIN, ACK] Seq=1 Ack=1 Win=1019 Len=0

Frame 31: 54 bytes on wire (432 bits), 54 bytes captured (432 bits) on interface \Device\NPF_{67513490-7E98-4839-87BB-68E6C8BE38B4}, id 0
Ethernet II, Src: Chongqin_1c:7e:89 (a4:97:b1:1c:7e:89), Dst: Tp-LinkT_94:6f:72 (84:d8:1b:94:6f:72)
Internet Protocol Version 4, Src: 192.168.0.111, Dst: 104.208.16.88
Transmission Control Protocol, Src Port: 50564, Dst Port: 443, Seq: 1, Ack: 1, Len: 0

No.     Time           Source                Destination           Protocol Length Info
     32 17.006075      192.168.0.111         224.0.0.22            IGMPv3   54     Membership Report / Join group 239.255.255.250 for any sources

Frame 32: 54 bytes on wire (432 bits), 54 bytes captured (432 bits) on interface \Device\NPF_{67513490-7E98-4839-87BB-68E6C8BE38B4}, id 0
Ethernet II, Src: Chongqin_1c:7e:89 (a4:97:b1:1c:7e:89), Dst: IPv4mcast_16 (01:00:5e:00:00:16)
Internet Protocol Version 4, Src: 192.168.0.111, Dst: 224.0.0.22
Internet Group Management Protocol

No.     Time           Source                Destination           Protocol Length Info
     33 17.047759      104.208.16.88         192.168.0.111         TCP      54     443 → 50564 [FIN, ACK] Seq=1 Ack=2 Win=2053 Len=0

Frame 33: 54 bytes on wire (432 bits), 54 bytes captured (432 bits) on interface \Device\NPF_{67513490-7E98-4839-87BB-68E6C8BE38B4}, id 0
Ethernet II, Src: Tp-LinkT_94:6f:72 (84:d8:1b:94:6f:72), Dst: Chongqin_1c:7e:89 (a4:97:b1:1c:7e:89)
Internet Protocol Version 4, Src: 104.208.16.88, Dst: 192.168.0.111
Transmission Control Protocol, Src Port: 443, Dst Port: 50564, Seq: 1, Ack: 2, Len: 0

No.     Time           Source                Destination           Protocol Length Info
     34 17.047912      192.168.0.111         104.208.16.88         TCP      54     50564 → 443 [ACK] Seq=2 Ack=2 Win=1019 Len=0

Frame 34: 54 bytes on wire (432 bits), 54 bytes captured (432 bits) on interface \Device\NPF_{67513490-7E98-4839-87BB-68E6C8BE38B4}, id 0
Ethernet II, Src: Chongqin_1c:7e:89 (a4:97:b1:1c:7e:89), Dst: Tp-LinkT_94:6f:72 (84:d8:1b:94:6f:72)
Internet Protocol Version 4, Src: 192.168.0.111, Dst: 104.208.16.88
Transmission Control Protocol, Src Port: 50564, Dst Port: 443, Seq: 2, Ack: 2, Len: 0

No.     Time           Source                Destination           Protocol Length Info
     35 17.147904      fe80::86d8:1bff:fe94:6f72 ff02::1               ICMPv6   110    Router Advertisement from 84:d8:1b:94:6f:72

Frame 35: 110 bytes on wire (880 bits), 110 bytes captured (880 bits) on interface \Device\NPF_{67513490-7E98-4839-87BB-68E6C8BE38B4}, id 0
Ethernet II, Src: Tp-LinkT_94:6f:72 (84:d8:1b:94:6f:72), Dst: Chongqin_1c:7e:89 (a4:97:b1:1c:7e:89)
Internet Protocol Version 6, Src: fe80::86d8:1bff:fe94:6f72, Dst: ff02::1
Internet Control Message Protocol v6

No.     Time           Source                Destination           Protocol Length Info
     36 18.602969      Tp-LinkT_94:6f:72     Chongqin_1c:7e:89     ARP      60     Who has 192.168.0.111? Tell 192.168.0.1

Frame 36: 60 bytes on wire (480 bits), 60 bytes captured (480 bits) on interface \Device\NPF_{67513490-7E98-4839-87BB-68E6C8BE38B4}, id 0
Ethernet II, Src: Tp-LinkT_94:6f:72 (84:d8:1b:94:6f:72), Dst: Chongqin_1c:7e:89 (a4:97:b1:1c:7e:89)
Address Resolution Protocol (request)

No.     Time           Source                Destination           Protocol Length Info
     37 18.603005      Chongqin_1c:7e:89     Tp-LinkT_94:6f:72     ARP      42     192.168.0.111 is at a4:97:b1:1c:7e:89

Frame 37: 42 bytes on wire (336 bits), 42 bytes captured (336 bits) on interface \Device\NPF_{67513490-7E98-4839-87BB-68E6C8BE38B4}, id 0
Ethernet II, Src: Chongqin_1c:7e:89 (a4:97:b1:1c:7e:89), Dst: Tp-LinkT_94:6f:72 (84:d8:1b:94:6f:72)
Address Resolution Protocol (reply)

No.     Time           Source                Destination           Protocol Length Info
     38 20.274869      Tp-LinkT_94:6f:72     Chongqin_1c:7e:89     ARP      60     Who has 192.168.0.111? Tell 192.168.0.1

Frame 38: 60 bytes on wire (480 bits), 60 bytes captured (480 bits) on interface \Device\NPF_{67513490-7E98-4839-87BB-68E6C8BE38B4}, id 0
Ethernet II, Src: Tp-LinkT_94:6f:72 (84:d8:1b:94:6f:72), Dst: Chongqin_1c:7e:89 (a4:97:b1:1c:7e:89)
Address Resolution Protocol (request)

No.     Time           Source                Destination           Protocol Length Info
     39 20.274907      Chongqin_1c:7e:89     Tp-LinkT_94:6f:72     ARP      42     192.168.0.111 is at a4:97:b1:1c:7e:89

Frame 39: 42 bytes on wire (336 bits), 42 bytes captured (336 bits) on interface \Device\NPF_{67513490-7E98-4839-87BB-68E6C8BE38B4}, id 0
Ethernet II, Src: Chongqin_1c:7e:89 (a4:97:b1:1c:7e:89), Dst: Tp-LinkT_94:6f:72 (84:d8:1b:94:6f:72)
Address Resolution Protocol (reply)

No.     Time           Source                Destination           Protocol Length Info
     40 20.344217      192.168.0.111         13.107.42.12          TCP      1494   50561 → 443 [ACK] Seq=1 Ack=1 Win=512 Len=1440 [TCP segment of a reassembled PDU]

Frame 40: 1494 bytes on wire (11952 bits), 1494 bytes captured (11952 bits) on interface \Device\NPF_{67513490-7E98-4839-87BB-68E6C8BE38B4}, id 0
Ethernet II, Src: Chongqin_1c:7e:89 (a4:97:b1:1c:7e:89), Dst: Tp-LinkT_94:6f:72 (84:d8:1b:94:6f:72)
Internet Protocol Version 4, Src: 192.168.0.111, Dst: 13.107.42.12
Transmission Control Protocol, Src Port: 50561, Dst Port: 443, Seq: 1, Ack: 1, Len: 1440

No.     Time           Source                Destination           Protocol Length Info
     41 20.344217      192.168.0.111         13.107.42.12          TLSv1.2  891    Application Data

Frame 41: 891 bytes on wire (7128 bits), 891 bytes captured (7128 bits) on interface \Device\NPF_{67513490-7E98-4839-87BB-68E6C8BE38B4}, id 0
Ethernet II, Src: Chongqin_1c:7e:89 (a4:97:b1:1c:7e:89), Dst: Tp-LinkT_94:6f:72 (84:d8:1b:94:6f:72)
Internet Protocol Version 4, Src: 192.168.0.111, Dst: 13.107.42.12
Transmission Control Protocol, Src Port: 50561, Dst Port: 443, Seq: 1441, Ack: 1, Len: 837
[2 Reassembled TCP Segments (2277 bytes): #40(1440), #41(837)]
Transport Layer Security

No.     Time           Source                Destination           Protocol Length Info
     42 20.344562      192.168.0.111         13.107.42.12          TCP      1494   50561 → 443 [ACK] Seq=2278 Ack=1 Win=512 Len=1440 [TCP segment of a reassembled PDU]

Frame 42: 1494 bytes on wire (11952 bits), 1494 bytes captured (11952 bits) on interface \Device\NPF_{67513490-7E98-4839-87BB-68E6C8BE38B4}, id 0
Ethernet II, Src: Chongqin_1c:7e:89 (a4:97:b1:1c:7e:89), Dst: Tp-LinkT_94:6f:72 (84:d8:1b:94:6f:72)
Internet Protocol Version 4, Src: 192.168.0.111, Dst: 13.107.42.12
Transmission Control Protocol, Src Port: 50561, Dst Port: 443, Seq: 2278, Ack: 1, Len: 1440

No.     Time           Source                Destination           Protocol Length Info
     43 20.344562      192.168.0.111         13.107.42.12          TCP      1494   50561 → 443 [ACK] Seq=3718 Ack=1 Win=512 Len=1440 [TCP segment of a reassembled PDU]

Frame 43: 1494 bytes on wire (11952 bits), 1494 bytes captured (11952 bits) on interface \Device\NPF_{67513490-7E98-4839-87BB-68E6C8BE38B4}, id 0
Ethernet II, Src: Chongqin_1c:7e:89 (a4:97:b1:1c:7e:89), Dst: Tp-LinkT_94:6f:72 (84:d8:1b:94:6f:72)
Internet Protocol Version 4, Src: 192.168.0.111, Dst: 13.107.42.12
Transmission Control Protocol, Src Port: 50561, Dst Port: 443, Seq: 3718, Ack: 1, Len: 1440

No.     Time           Source                Destination           Protocol Length Info
     44 20.344562      192.168.0.111         13.107.42.12          TCP      1494   50561 → 443 [ACK] Seq=5158 Ack=1 Win=512 Len=1440 [TCP segment of a reassembled PDU]

Frame 44: 1494 bytes on wire (11952 bits), 1494 bytes captured (11952 bits) on interface \Device\NPF_{67513490-7E98-4839-87BB-68E6C8BE38B4}, id 0
Ethernet II, Src: Chongqin_1c:7e:89 (a4:97:b1:1c:7e:89), Dst: Tp-LinkT_94:6f:72 (84:d8:1b:94:6f:72)
Internet Protocol Version 4, Src: 192.168.0.111, Dst: 13.107.42.12
Transmission Control Protocol, Src Port: 50561, Dst Port: 443, Seq: 5158, Ack: 1, Len: 1440

No.     Time           Source                Destination           Protocol Length Info
     45 20.344562      192.168.0.111         13.107.42.12          TCP      1494   50561 → 443 [ACK] Seq=6598 Ack=1 Win=512 Len=1440 [TCP segment of a reassembled PDU]

Frame 45: 1494 bytes on wire (11952 bits), 1494 bytes captured (11952 bits) on interface \Device\NPF_{67513490-7E98-4839-87BB-68E6C8BE38B4}, id 0
Ethernet II, Src: Chongqin_1c:7e:89 (a4:97:b1:1c:7e:89), Dst: Tp-LinkT_94:6f:72 (84:d8:1b:94:6f:72)
Internet Protocol Version 4, Src: 192.168.0.111, Dst: 13.107.42.12
Transmission Control Protocol, Src Port: 50561, Dst Port: 443, Seq: 6598, Ack: 1, Len: 1440

No.     Time           Source                Destination           Protocol Length Info
     46 20.344562      192.168.0.111         13.107.42.12          TCP      1494   50561 → 443 [ACK] Seq=8038 Ack=1 Win=512 Len=1440 [TCP segment of a reassembled PDU]

Frame 46: 1494 bytes on wire (11952 bits), 1494 bytes captured (11952 bits) on interface \Device\NPF_{67513490-7E98-4839-87BB-68E6C8BE38B4}, id 0
Ethernet II, Src: Chongqin_1c:7e:89 (a4:97:b1:1c:7e:89), Dst: Tp-LinkT_94:6f:72 (84:d8:1b:94:6f:72)
Internet Protocol Version 4, Src: 192.168.0.111, Dst: 13.107.42.12
Transmission Control Protocol, Src Port: 50561, Dst Port: 443, Seq: 8038, Ack: 1, Len: 1440

No.     Time           Source                Destination           Protocol Length Info
     47 20.344562      192.168.0.111         13.107.42.12          TCP      1494   50561 → 443 [ACK] Seq=9478 Ack=1 Win=512 Len=1440 [TCP segment of a reassembled PDU]

Frame 47: 1494 bytes on wire (11952 bits), 1494 bytes captured (11952 bits) on interface \Device\NPF_{67513490-7E98-4839-87BB-68E6C8BE38B4}, id 0
Ethernet II, Src: Chongqin_1c:7e:89 (a4:97:b1:1c:7e:89), Dst: Tp-LinkT_94:6f:72 (84:d8:1b:94:6f:72)
Internet Protocol Version 4, Src: 192.168.0.111, Dst: 13.107.42.12
Transmission Control Protocol, Src Port: 50561, Dst Port: 443, Seq: 9478, Ack: 1, Len: 1440

No.     Time           Source                Destination           Protocol Length Info
     48 20.344562      192.168.0.111         13.107.42.12          TCP      1494   50561 → 443 [ACK] Seq=10918 Ack=1 Win=512 Len=1440 [TCP segment of a reassembled PDU]

Frame 48: 1494 bytes on wire (11952 bits), 1494 bytes captured (11952 bits) on interface \Device\NPF_{67513490-7E98-4839-87BB-68E6C8BE38B4}, id 0
Ethernet II, Src: Chongqin_1c:7e:89 (a4:97:b1:1c:7e:89), Dst: Tp-LinkT_94:6f:72 (84:d8:1b:94:6f:72)
Internet Protocol Version 4, Src: 192.168.0.111, Dst: 13.107.42.12
Transmission Control Protocol, Src Port: 50561, Dst Port: 443, Seq: 10918, Ack: 1, Len: 1440

No.     Time           Source                Destination           Protocol Length Info
     49 20.344562      192.168.0.111         13.107.42.12          TCP      1494   50561 → 443 [ACK] Seq=12358 Ack=1 Win=512 Len=1440 [TCP segment of a reassembled PDU]

Frame 49: 1494 bytes on wire (11952 bits), 1494 bytes captured (11952 bits) on interface \Device\NPF_{67513490-7E98-4839-87BB-68E6C8BE38B4}, id 0
Ethernet II, Src: Chongqin_1c:7e:89 (a4:97:b1:1c:7e:89), Dst: Tp-LinkT_94:6f:72 (84:d8:1b:94:6f:72)
Internet Protocol Version 4, Src: 192.168.0.111, Dst: 13.107.42.12
Transmission Control Protocol, Src Port: 50561, Dst Port: 443, Seq: 12358, Ack: 1, Len: 1440

No.     Time           Source                Destination           Protocol Length Info
     50 20.344562      192.168.0.111         13.107.42.12          TCP      1494   50561 → 443 [ACK] Seq=13798 Ack=1 Win=512 Len=1440 [TCP segment of a reassembled PDU]

Frame 50: 1494 bytes on wire (11952 bits), 1494 bytes captured (11952 bits) on interface \Device\NPF_{67513490-7E98-4839-87BB-68E6C8BE38B4}, id 0
Ethernet II, Src: Chongqin_1c:7e:89 (a4:97:b1:1c:7e:89), Dst: Tp-LinkT_94:6f:72 (84:d8:1b:94:6f:72)
Internet Protocol Version 4, Src: 192.168.0.111, Dst: 13.107.42.12
Transmission Control Protocol, Src Port: 50561, Dst Port: 443, Seq: 13798, Ack: 1, Len: 1440

No.     Time           Source                Destination           Protocol Length Info
     51 20.344562      192.168.0.111         13.107.42.12          TCP      1494   50561 → 443 [ACK] Seq=15238 Ack=1 Win=512 Len=1440 [TCP segment of a reassembled PDU]

Frame 51: 1494 bytes on wire (11952 bits), 1494 bytes captured (11952 bits) on interface \Device\NPF_{67513490-7E98-4839-87BB-68E6C8BE38B4}, id 0
Ethernet II, Src: Chongqin_1c:7e:89 (a4:97:b1:1c:7e:89), Dst: Tp-LinkT_94:6f:72 (84:d8:1b:94:6f:72)
Internet Protocol Version 4, Src: 192.168.0.111, Dst: 13.107.42.12
Transmission Control Protocol, Src Port: 50561, Dst Port: 443, Seq: 15238, Ack: 1, Len: 1440

No.     Time           Source                Destination           Protocol Length Info
     52 20.344562      192.168.0.111         13.107.42.12          TLSv1.2  1494   Application Data

Frame 52: 1494 bytes on wire (11952 bits), 1494 bytes captured (11952 bits) on interface \Device\NPF_{67513490-7E98-4839-87BB-68E6C8BE38B4}, id 0
Ethernet II, Src: Chongqin_1c:7e:89 (a4:97:b1:1c:7e:89), Dst: Tp-LinkT_94:6f:72 (84:d8:1b:94:6f:72)
Internet Protocol Version 4, Src: 192.168.0.111, Dst: 13.107.42.12
Transmission Control Protocol, Src Port: 50561, Dst Port: 443, Seq: 16678, Ack: 1, Len: 1440
[11 Reassembled TCP Segments (15360 bytes): #42(1440), #43(1440), #44(1440), #45(1440), #46(1440), #47(1440), #48(1440), #49(1440), #50(1440), #51(1440), #52(960)]
Transport Layer Security

No.     Time           Source                Destination           Protocol Length Info
     53 20.344562      192.168.0.111         13.107.42.12          TCP      1494   50561 → 443 [ACK] Seq=18118 Ack=1 Win=512 Len=1440 [TCP segment of a reassembled PDU]

Frame 53: 1494 bytes on wire (11952 bits), 1494 bytes captured (11952 bits) on interface \Device\NPF_{67513490-7E98-4839-87BB-68E6C8BE38B4}, id 0
Ethernet II, Src: Chongqin_1c:7e:89 (a4:97:b1:1c:7e:89), Dst: Tp-LinkT_94:6f:72 (84:d8:1b:94:6f:72)
Internet Protocol Version 4, Src: 192.168.0.111, Dst: 13.107.42.12
Transmission Control Protocol, Src Port: 50561, Dst Port: 443, Seq: 18118, Ack: 1, Len: 1440

No.     Time           Source                Destination           Protocol Length Info
     54 20.344562      192.168.0.111         13.107.42.12          TCP      1494   50561 → 443 [ACK] Seq=19558 Ack=1 Win=512 Len=1440 [TCP segment of a reassembled PDU]

Frame 54: 1494 bytes on wire (11952 bits), 1494 bytes captured (11952 bits) on interface \Device\NPF_{67513490-7E98-4839-87BB-68E6C8BE38B4}, id 0
Ethernet II, Src: Chongqin_1c:7e:89 (a4:97:b1:1c:7e:89), Dst: Tp-LinkT_94:6f:72 (84:d8:1b:94:6f:72)
Internet Protocol Version 4, Src: 192.168.0.111, Dst: 13.107.42.12
Transmission Control Protocol, Src Port: 50561, Dst Port: 443, Seq: 19558, Ack: 1, Len: 1440

No.     Time           Source                Destination           Protocol Length Info
     55 20.344562      192.168.0.111         13.107.42.12          TCP      1494   50561 → 443 [ACK] Seq=20998 Ack=1 Win=512 Len=1440 [TCP segment of a reassembled PDU]

Frame 55: 1494 bytes on wire (11952 bits), 1494 bytes captured (11952 bits) on interface \Device\NPF_{67513490-7E98-4839-87BB-68E6C8BE38B4}, id 0
Ethernet II, Src: Chongqin_1c:7e:89 (a4:97:b1:1c:7e:89), Dst: Tp-LinkT_94:6f:72 (84:d8:1b:94:6f:72)
Internet Protocol Version 4, Src: 192.168.0.111, Dst: 13.107.42.12
Transmission Control Protocol, Src Port: 50561, Dst Port: 443, Seq: 20998, Ack: 1, Len: 1440

No.     Time           Source                Destination           Protocol Length Info
     56 20.344562      192.168.0.111         13.107.42.12          TCP      1494   50561 → 443 [ACK] Seq=22438 Ack=1 Win=512 Len=1440 [TCP segment of a reassembled PDU]

Frame 56: 1494 bytes on wire (11952 bits), 1494 bytes captured (11952 bits) on interface \Device\NPF_{67513490-7E98-4839-87BB-68E6C8BE38B4}, id 0
Ethernet II, Src: Chongqin_1c:7e:89 (a4:97:b1:1c:7e:89), Dst: Tp-LinkT_94:6f:72 (84:d8:1b:94:6f:72)
Internet Protocol Version 4, Src: 192.168.0.111, Dst: 13.107.42.12
Transmission Control Protocol, Src Port: 50561, Dst Port: 443, Seq: 22438, Ack: 1, Len: 1440

No.     Time           Source                Destination           Protocol Length Info
     57 20.344562      192.168.0.111         13.107.42.12          TCP      1494   50561 → 443 [ACK] Seq=23878 Ack=1 Win=512 Len=1440 [TCP segment of a reassembled PDU]

Frame 57: 1494 bytes on wire (11952 bits), 1494 bytes captured (11952 bits) on interface \Device\NPF_{67513490-7E98-4839-87BB-68E6C8BE38B4}, id 0
Ethernet II, Src: Chongqin_1c:7e:89 (a4:97:b1:1c:7e:89), Dst: Tp-LinkT_94:6f:72 (84:d8:1b:94:6f:72)
Internet Protocol Version 4, Src: 192.168.0.111, Dst: 13.107.42.12
Transmission Control Protocol, Src Port: 50561, Dst Port: 443, Seq: 23878, Ack: 1, Len: 1440

No.     Time           Source                Destination           Protocol Length Info
     58 20.344562      192.168.0.111         13.107.42.12          TCP      1494   50561 → 443 [ACK] Seq=25318 Ack=1 Win=512 Len=1440 [TCP segment of a reassembled PDU]

Frame 58: 1494 bytes on wire (11952 bits), 1494 bytes captured (11952 bits) on interface \Device\NPF_{67513490-7E98-4839-87BB-68E6C8BE38B4}, id 0
Ethernet II, Src: Chongqin_1c:7e:89 (a4:97:b1:1c:7e:89), Dst: Tp-LinkT_94:6f:72 (84:d8:1b:94:6f:72)
Internet Protocol Version 4, Src: 192.168.0.111, Dst: 13.107.42.12
Transmission Control Protocol, Src Port: 50561, Dst Port: 443, Seq: 25318, Ack: 1, Len: 1440

No.     Time           Source                Destination           Protocol Length Info
     59 20.344562      192.168.0.111         13.107.42.12          TCP      1494   50561 → 443 [ACK] Seq=26758 Ack=1 Win=512 Len=1440 [TCP segment of a reassembled PDU]

Frame 59: 1494 bytes on wire (11952 bits), 1494 bytes captured (11952 bits) on interface \Device\NPF_{67513490-7E98-4839-87BB-68E6C8BE38B4}, id 0
Ethernet II, Src: Chongqin_1c:7e:89 (a4:97:b1:1c:7e:89), Dst: Tp-LinkT_94:6f:72 (84:d8:1b:94:6f:72)
Internet Protocol Version 4, Src: 192.168.0.111, Dst: 13.107.42.12
Transmission Control Protocol, Src Port: 50561, Dst Port: 443, Seq: 26758, Ack: 1, Len: 1440

No.     Time           Source                Destination           Protocol Length Info
     60 20.344562      192.168.0.111         13.107.42.12          TCP      1494   50561 → 443 [ACK] Seq=28198 Ack=1 Win=512 Len=1440 [TCP segment of a reassembled PDU]

Frame 60: 1494 bytes on wire (11952 bits), 1494 bytes captured (11952 bits) on interface \Device\NPF_{67513490-7E98-4839-87BB-68E6C8BE38B4}, id 0
Ethernet II, Src: Chongqin_1c:7e:89 (a4:97:b1:1c:7e:89), Dst: Tp-LinkT_94:6f:72 (84:d8:1b:94:6f:72)
Internet Protocol Version 4, Src: 192.168.0.111, Dst: 13.107.42.12
Transmission Control Protocol, Src Port: 50561, Dst Port: 443, Seq: 28198, Ack: 1, Len: 1440

No.     Time           Source                Destination           Protocol Length Info
     61 20.344562      192.168.0.111         13.107.42.12          TCP      1494   50561 → 443 [ACK] Seq=29638 Ack=1 Win=512 Len=1440 [TCP segment of a reassembled PDU]

Frame 61: 1494 bytes on wire (11952 bits), 1494 bytes captured (11952 bits) on interface \Device\NPF_{67513490-7E98-4839-87BB-68E6C8BE38B4}, id 0
Ethernet II, Src: Chongqin_1c:7e:89 (a4:97:b1:1c:7e:89), Dst: Tp-LinkT_94:6f:72 (84:d8:1b:94:6f:72)
Internet Protocol Version 4, Src: 192.168.0.111, Dst: 13.107.42.12
Transmission Control Protocol, Src Port: 50561, Dst Port: 443, Seq: 29638, Ack: 1, Len: 1440

No.     Time           Source                Destination           Protocol Length Info
     62 20.344562      192.168.0.111         13.107.42.12          TCP      1494   50561 → 443 [ACK] Seq=31078 Ack=1 Win=512 Len=1440 [TCP segment of a reassembled PDU]

Frame 62: 1494 bytes on wire (11952 bits), 1494 bytes captured (11952 bits) on interface \Device\NPF_{67513490-7E98-4839-87BB-68E6C8BE38B4}, id 0
Ethernet II, Src: Chongqin_1c:7e:89 (a4:97:b1:1c:7e:89), Dst: Tp-LinkT_94:6f:72 (84:d8:1b:94:6f:72)
Internet Protocol Version 4, Src: 192.168.0.111, Dst: 13.107.42.12
Transmission Control Protocol, Src Port: 50561, Dst Port: 443, Seq: 31078, Ack: 1, Len: 1440

No.     Time           Source                Destination           Protocol Length Info
     63 20.344562      192.168.0.111         13.107.42.12          TLSv1.2  1494   Application Data

Frame 63: 1494 bytes on wire (11952 bits), 1494 bytes captured (11952 bits) on interface \Device\NPF_{67513490-7E98-4839-87BB-68E6C8BE38B4}, id 0
Ethernet II, Src: Chongqin_1c:7e:89 (a4:97:b1:1c:7e:89), Dst: Tp-LinkT_94:6f:72 (84:d8:1b:94:6f:72)
Internet Protocol Version 4, Src: 192.168.0.111, Dst: 13.107.42.12
Transmission Control Protocol, Src Port: 50561, Dst Port: 443, Seq: 32518, Ack: 1, Len: 1440
[12 Reassembled TCP Segments (15360 bytes): #52(480), #53(1440), #54(1440), #55(1440), #56(1440), #57(1440), #58(1440), #59(1440), #60(1440), #61(1440), #62(1440), #63(480)]
Transport Layer Security

No.     Time           Source                Destination           Protocol Length Info
     64 20.344562      192.168.0.111         13.107.42.12          TCP      1494   50561 → 443 [ACK] Seq=33958 Ack=1 Win=512 Len=1440 [TCP segment of a reassembled PDU]

Frame 64: 1494 bytes on wire (11952 bits), 1494 bytes captured (11952 bits) on interface \Device\NPF_{67513490-7E98-4839-87BB-68E6C8BE38B4}, id 0
Ethernet II, Src: Chongqin_1c:7e:89 (a4:97:b1:1c:7e:89), Dst: Tp-LinkT_94:6f:72 (84:d8:1b:94:6f:72)
Internet Protocol Version 4, Src: 192.168.0.111, Dst: 13.107.42.12
Transmission Control Protocol, Src Port: 50561, Dst Port: 443, Seq: 33958, Ack: 1, Len: 1440

No.     Time           Source                Destination           Protocol Length Info
     65 20.344562      192.168.0.111         13.107.42.12          TCP      1494   50561 → 443 [ACK] Seq=35398 Ack=1 Win=512 Len=1440 [TCP segment of a reassembled PDU]

Frame 65: 1494 bytes on wire (11952 bits), 1494 bytes captured (11952 bits) on interface \Device\NPF_{67513490-7E98-4839-87BB-68E6C8BE38B4}, id 0
Ethernet II, Src: Chongqin_1c:7e:89 (a4:97:b1:1c:7e:89), Dst: Tp-LinkT_94:6f:72 (84:d8:1b:94:6f:72)
